Title,Link,Date

"Staff Spotlight - Megan Lane, Operations & Events Associate",/blog/staff-spotlight-megan-lane,2018-09-11

Different Approaches to Using Relational Databases with Express,/blog/different-approaches-express,2018-08-28

The Job Funnel,/blog/the-job-funnel,2018-08-20

Alumni Spotlight: Daniel Szabo,/blog/alumni-spotlight-daniel,2018-08-08

Rithm School Interview FAQs,/blog/rithm-interview-faqs,2018-08-01

BPPE Approval and Outcomes Numbers,/blog/bppe-approval-and-outcomes-numbers,2018-07-25

What’s New in Python 3.7: Data Classes,/blog/whats-new-in-python-3-7,2018-07-11

Five Tips for Getting Yourself Unstuck,/blog/five-tips-for-getting-yourself-unstuck,2018-06-22

A Roadmap for Learning How To Code - Part 3,/blog/roadmap-for-learning-how-to-code-03,2018-06-13

Student Interview: Paula + Miranda on Company Projects,/blog/student-interview-paula-miranda,2018-06-05

